id;NOME_PRODUTO;CODE;DESCRIPTION
18635;SMARTPHONE SAMSUNG GAL J6 32GB DB VIOLETA    ;025249;"<span style=\\""font-size:11pt\\""><span style=\\""background:#f9f9f9\\""><span style=\\""line-height:107%\\""><span style=\\""font-family:&quot;Calibri&quot;,sans-serif\\""><span style=\\""color:#686868\\"">O Samsung Galaxy J6 32GB traz consigo uma ampla tela de 5,6 polegadas com tecnologia Super Amoled e qualidade de resolução em FULL HD, proporcionando uma experiência com cores mais vivas, para você assistir suas programações favoritas em qualquer lugar através da tv digital, assistir vídeos e mandar bem nos seus games.  Além disso o smartphone dispõe do App Pair que possibilita a visualização de vídeos e aplicativos de mensagens simultaneamente, permitindo que você possa continuar assistindo série favorita enquanto responde as mensagens dos seus amigos. Para você registrar todos os momentos da sua vida, ele vem com câmera traseira de 13MP e uma de selfie de 8 MP, ambas com flash LED para deixar as suas fotos sempre nítidas. O seu processador octa core evita que ocorra travamentos durante o uso, enquanto que o seu amplo armazenamento de 32GB, expansível até 256 GB através da entrada micro SD, somados aos 15 GB de capacidade de armazenamento disponíveis no Samsung Cloud, faz com que você não precise ter que escolher entre seus aplicativos favoritos e suas fotos.', '', '', '', '', '"
18822;RADIO AUTOMOTIVO P3335 POP 1 4X25WRMS PT     ;025999;"O Som Automotivo Pop é o item que faltava para deixar o seu carro ainda mais completo e equipado. Com alta potência de 25W, você tem uma reprodução de som com alta fidelidade e sem ruídos."
19388;SMARTPHONE LENOVO VIBE K6 DB GRAFITE         ;022804;[]
19547;SMARTPHONE SAMSUNG GALAXY J4 PLUS 32GB COBRE ;025576;"   Prepare-se para ter uma experiência visual completamente nova. O Galaxy J4 plus tem um incrível Display Infinito HD+ de 6,0&quot; que te faz imergir nos seus conteúdos favoritos com cores vivas e nítidas. Seu design elegante é confortável ao toque, com acabamento polido especial e várias opções de cores para combinar com o seu estilo.     Graças à sua câmera traseira de alta resolução de 13 MP e frontal de 5 MP ambas com flash LED, ele te garante fotos com alta qualidade de imagem mesmo em ambientes escuros. E para você não precisar escolher entre assistir sua série preferida e responder as mensagens dos seus amigos, ele conta com a função Par de Apps, que permite realizar tarefas distintas ao mesmo tempo. Pensa que acaba por aqui? O  Galaxy J4 plus ainda conta com amplo armazenamento de 32GB que pode ser expandido em até 512GB com um cartão de memória, para você ter espaço suficiente para as suas fotos e aplicativos e possui uma bateria de 3300mAh para te acompanhar durante todo o dia', '', '', '"
19654;"TELEVISOR SMART 55"" 4K QN55Q60RAGXZD         ";025908;"Você irá se apaixonar pela tecnologia e inovação da Samsung QN55Q60RA.Uma Smart TV com tela QLED de 55&quot;, resolução Ultra HD 4K (3840x2160) e 120Hz de frequência.Ela possui ainda, design com visual livre de cabos, sistema operacional Tizen, conectividade através de Wi-Fi e Bluetooth, conversor digital integrado, 4 entradas HDMI e 2 USB.', ' ', ' ', ' "
19696;NOTEBOOK X200MA CT204HCEL.D.C.2G H500 W8.1BR ;020782;[]
20141;CAIXA AMPLIFICADA CM-14 MULT CONECT          ;025704;"A Caixa Amplificada Multuso Conect Party da Mondial é ideal para você que aprecia som de qualidade e mixagens eletrizantes, suas festas e reuniões com amigos e família nunca mais serão as mesmas.', '', '', '', '\\n\\n<p style=\\""margin-bottom:13px\\""> Esta incrível e sofisticada caixa amplificada possui a incrível função, cartão micro SD ou conexão Dual Bluetooth que permite a conexão simultânea de 2 smartphones , ele também possui entrada auxiliar, entrada para microfone e guitarra, display digital, potência de 400W RMS, bateria interna e recarregável além de ser bivolt. Compatível com guitarra, violão, teclado, computador, notebook, aparelho televisor, aparelho MP3/MP4, celular, retroprojetor e com suas alça e rodas para facilitar o transporte você pode levar a Caixa Amplificadora Multuso Conect Party para qual quer lugar e agitar com a galera. ', '', '', '"
20474;SMARTPHONE SAMSUNG GAL A7 64GB PRETO         ;025659;" O Galaxy A7 Com seu design elegante e belas cores, conta com display infinito Super AMOLED full HD+ brilhante de 6.0&quot; que produz contrastes mais nítidos e cores mais dinâmicas e vivas. Ele comporta três câmeras traseira de 24MP + 8MP + 5MP e frontal de 24MP ambas com flash LED que vão te permitir fotografar paisagens amplas com efeito ultra wide. Tire fotos mais profissionais usando o sistema de câmera inteligente que ajusta automaticamente a saturação, equilíbrio de brancos e nível de brilho, destaque a beleza das suas fotos ajustando a profundidade de campo para focar no que você quer destacar na sua imagem. Com processador octa core de 2.2 GHZ ele promete velocidade e fluidez, seja nos seus jogos, redes sociais ou tarefas do dia a dia. O Galaxy A7 traz consigo uma memória interna de 64GB e RAM de 4GB que vão de fornecer amplo espaço de armazenamento para guardar suas mídias, aplicativos e jogos que você ama. Além disso tudo ele ainda conta com uma incrível bateria de 3300mAh para usar e abusar durante o dia todo.', '', '', '"
20756;"TABLET NB238 DISNEY STAR WARS 7""             ";024369;"A Multilaser está sempre em busca de novidades! Desta vez, a grande notícia vai para toda criançada: um Tablet personalizado da linha Disney Star Wars! Para todos os amantes deste incrível filme, é um tablet infantil completo, com as melhores features garantindo a diversão dos pequenos."
20873;TABLET NB249 GALINHA PINTADINHA              ;024370;"Agora você pode levar a galinha pintadinha e sua turma para sua casa! E mais vem com 4 dvds inclusos e mais de 50 desenhos musicais para fazer a diversão da garotada. "
21020;AUTO RADIO DEH-S1080UB                       ;010216;"Curta sua playlist especial com o DEH-S1080UB. Ele reproduz todos os seus sons, tanto por CD quanto por pendrive, e até as músicas do seu smartphone Android. A experiência fica ainda mais completa com a função MIXTRAX, que cria efeitos de DJ entre as músicas. Além disso, você também consegue programar e personalizar detalhes do seu som por meio do seu celular graças ao aplicativo Pioneer ARC, entre eles a iluminação, nas cores âmbar ou azul."
21407;SUPORTE FIXO V4 B NO1V4 32 A 55              ;017200;"A ELG traz o Suporte fixo de parede para TV&#39;s LCD/LED/Plasma de 32 a 55&quot;. Indicado para TVs / Monitores LCD / LED / PLASMA / 3D de 32&quot; a 55&rdquo; com o peso de até 50 kg e compatíveis com padrão de fixação VESA 100x100, 200x100, 200x200, 300x300, 400x200, 400x300 ou 400x400 mm (HxV)."
21439;"TELEVISOR SMART 32"" PTV32 G50SN LED PHILCO   ";025737;"A Smart TV PTV32G50SN da Philco com tela LED de 32&quot; é a tecnologia que falta na sua casa. Ela vai te proporcionar maior nitidez, clareza e definição, para você assistir e curtir ao máximo seus programas, filmes e series preferidos. Conta ainda com processador Duo Core proporcionando maior velocidade e performance para o seu televisor. Com design moderno, imagem em HD, conexões HDMI e USB, conversor digital integrado, Wi-Fi integrado, função DNR, que reduz os ruídos de imagem e Som Surround, que recria um ambiente mais realista de áudio, aumentando a qualidade sonora, e muito mais, ela é a escolha perfeita para transformar sua sala em um verdadeira sala de cinema. "
21500;SMARTPHONE SAMSUNG GALAXY J4 PLUS 32GB PRETO ;025577;"  Prepare-se para ter uma experiência visual completamente nova. O Galaxy J4 plus tem um incrível Display Infinito HD+ de 6,0&quot; que te faz imergir nos seus conteúdos favoritos com cores vivas e nítidas. Seu design elegante é confortável ao toque, com acabamento polido especial e várias opções de cores para combinar com o seu estilo.', '', '', '', '\\n\\n<p style=\\""margin-left: 28px; margin-bottom: 11px;\\"">   Graças à sua câmera traseira de alta resolução de 13 MP e frontal de 5 MP ambas com flash LED, ele te garante fotos com alta qualidade de imagem mesmo em ambientes escuros. E para você não precisar escolher entre assistir sua série preferida e responder as mensagens dos seus amigos, ele conta com a função Par de Apps, que permite realizar tarefas distintas ao mesmo tempo. Pensa que acaba por aqui? O  Galaxy J4 plus ainda conta com amplo armazenamento de 32GB que pode ser expandido em até 512GB com um cartão de memória, para você ter espaço suficiente para as suas fotos e aplicativos e possui uma bateria de 3300mAh para te acompanhar durante todo o dia', '', '', '"
22197;SMARTPHONE SAMSUNG GAL J1 MINI DB PRETO      ;022131;" O J1 Mini, primeiro modelo da linha J da Samsung é um smartphone para quem quer um smartphone compacto porém completo. Ele possui um processador Quad Core que permite que você reproduza vídeos, visualize suas redes sociais e demais tarefas com fluidez e conforto. Além da sua memória de 8GB possui entrada para cartão micro SD externo de até 128 GB, possibilitando que você armazene os arquivos que quiser. Com suas câmeras traseira e frontal registre momentos inesquecíveis e  para que você mantenha sua lista de contatos atualizada e faça e receba ligações de operadoras distintas, ele possui entrada para dois chips. ', '', '', '"
22418;SMARTPHONE MOTOROLA MOTO G7 PLUS XT1965-2 RUB;025682;" O Moto G7 Plus é um smartphone inovador que traz um conjunto de tecnologias que vão te dar uma experiência totalmente nova! Sua incrível tela imersiva de 6.24&rdquo; polegadas Full HD+ vai te surpreender no quesito visual e qualidade de imagem. E para sua segurança e praticidade ele conta com sensor de impressão digital, que dá acesso apenas à pessoas com as digitais cadastradas de forma rápida e prática.       Explore toda sua criatividade com as super câmeras duplas na traseira de 16MP e 5 MP com flash LED duplo e crie selfies perfeitas com a câmera frontal de 12 MP. Além disso o Moto G7 Plus veio para acabar com a tela travada e falta de espaço, pois ele conta com um processador octa-core de 1.8 Ghz somado a memória RAM de 4GB e memória interna de 64GB, possibilitando que você realize várias tarefas ao mesmo tempo sem se preocupar com travamentos inesperados e com falta de espaço para armazenar suas fotos e baixar novos aplicativos.', '', '', '"
22797;PEN DRIVE 8GB MC058 3X1 ADAPTADOR SD         ;019415;[]
22920;HOME THEATER HT-09 MONDIAL                   ;019403;"O Home Theater Mondial HT-09 é um aparelho versátil e fácil de instalar para você poder aproveitar ao máximo o seu ambiente! o Home Theater Mondial HT-09 . Com design compacto e SD Card, esse aparelho reproduz mídias em formatos de DVD, CD, HDMI USB e MP3. Com 420 watts de potência ainda conta com função karaokê, , função ripping, que permite copiar músicas de um CD de áudio para dispositivos USB sem a necessidade de computador e disc copying onde é possível copiar fotos e vídeos de um CD/DVD para seus dispositivos USB. "
23012;SMARTPHONE LG K9 TV LM-X210BMW DOURADO       ;025481;" O LG K9 foi desenvolvido para você que tem uma vida corrida, pois com ele você pode acompanhar seus filmes, séries, novelas e futebol em qualquer lugar, graças a sua TV Digital, pra você assistir a qualquer hora e lugar em uma tela ampla de 5 polegadas.     Seu design proporciona sofisticação e modernidade em um só, com conforto e segurança devido as suas bordas suavemente arredondadas e traseira antiderrapante, que proporcionam uma experiência mais confortável e tátil. Com a câmera frontal de 5MP captura selfies nítidas e cheias de vida, enquanto que sua câmera traseira pode capturar imagens inesquecíveis com alta qualidade. E para você não se preocupar com lentidão e falta de carga, ele vem com um processador Quad core somado a memória RAM de 2GB e uma bateria de 2500mAh, tudo isso para você aproveitar seus jogos, assistir vídeos e acessar as suas redes sociais favoritas.', '', '', '"
23555;"TELEVISOR SMART 28"" 28MT49S LG               ";024376;[]
24220;SOUNDBOX BRANCO VA 1306                      ;020503;"Cante, dance e se divirta por muitas horas com o SoundBox Vizio VA1306. Se você gosta de novidades e de tecnologia não pode ficar fora dessa, pois o SoundBox Vizio é ideal para quem gosta de passar horas de seu dia ouvindo uma música de qualidade e com total mobilidade. Esse potente reprodutor sonoro é supercompactoe bem leve, podendo ser levado para qualquer lugar como um aniversário, evento, churrasco, viagem e até mesmo uma reunião profissional ou apresentação escolar.', 'Com dois alto-falantes embutidos de 8W de potência você consegue a sonoridade perfeita para seu entretenimento. Ele também possui outras utilidades como usá-lo para atender uma ligação telefônica ou usá-lo para ouvir seu aparelho MP3 player através da entrada auxiliar. O potente eletrônico da Vizio possui suporte para um cartão de memória TF (vendido separadamente) de 16 GB, para que você guarde seus arquivos de áudio. Além disso, você também poderá reproduzir suas músicas através das tecnologias Bluetooth e NFC, de uma forma bem simples, apenas aproximando seu dispositivo que tenha alguma dessas características ao SoundBox, não sendo necessária a presença de nenhum fio ou cabo.', ' "
24608;SMARTPHONE MOTOROLA MOTO G5 PLUS XT1683 DB DR;023289;[]
24893;CAIXA AMPLIFICADA MCO-04 MULT CONNECT MONDIAL;022932;"A caixa acústica Multi Connect MCO-04 foi fabricada pela Mondial para suprir a necessidade de consumidores apaixonados por música, que adoram reuniões entre amigos e festas.<br />\\nDesenvolvida com entradas USB, cartão SD, bateria interna, microfone com fio, saída para instrumentos musicais, entrada auxiliar e rádio FM com sintonia digital, tenha alta qualidade sonora e tecnologia em um só produto. Com conexão Bluetooth, a Multi Connect MCO-04 permite que você conecte sua playlist preferida com muita potência e qualidade de som diretamente do seu Smartphone, ligue a função Bluetooth do seu Smartphone, espere localizar o dispositivo Mondial MCO, faça a conexão e após o pareamento é só aproveitar todas as suas musicas prediletas. "
25106;TABLET BRAVVA BV QUAD PLUS 8G PRETO          ;024598;[]
25293;TELEJOGO MOD XP 180                          ;021513;[]
25503;TABLET BRAVVA BV QUAD PLUS 8G BRANCO         ;024597;[]
25574;SMARTPHONE SAMSUNG GAL A20  A205 32GB PRETO  ;026003;" O Galaxy A20  é um smartphone para quem não abre mão de imagens de qualidade, ele vem com um display infinito de 6,4 polegadas com a tecnologia Super Amoled Full HD+ para você jogar, assistir vídeos e séries favoritas em alta qualidade de imagem. Suas câmeras, traseira de 13MP + 5MP e a de selfie de 8MP possibilitam que você tire fotos incríveis com muito mais amplitude no modo ultra-wide. E para que você não se preocupe com a segurança dos seus dados ele vem com sensor de impressão digital para que apenas pessoas com a digital cadastrada possa desbloquear seu aparelho. O processador octa core de 1.6 Ghz somado a memória RAM de 3GB, evita aqueles travamentos indesejáveis, te proporcionando uma ótima experiência. E para você ficar conectado o dia todo o Galaxy A20 ainda conta com uma bateria de 4000mAh.     ', '', '', '"
25761;AUTO RADIO MVH-S218BT PIONNER                ;025670;"O MVH-S218BT chegou com esse design essencial para permitir que você desfrute de chamadas viva-voz e streaming de áudio no carro, através do Bluetooth embutido com microfone interno. Além disso, entrada USB frontal, entrada auxiliar e rádio AM / FM. Não faltam opções!<br />\\nBusque e selecione com segurança artistas, álbuns e listas de reprodução usando os botões de controle da Pioneer.<br />\\nCom o MVH-S218BT, você tem entretenimento sonoro dentro do seu carro a todos os momentos.', '', '', '"
26004;SMARTPHONE MOTOROLA MOTO Z3 PLAY INDIGO      ;025151;"O Moto Z3 Play é um modelo completo, seu conjunto de tecnologias vai te surpreender. Começando com sua tela Max Vision de 6.0&quot; polegadas, com bordas finas e com tecnologia Super Amoled, que vão te trazer uma experiência mais imersiva ao consumir conteúdo multimídia com cores mais reais e vivas. Na traseira, possui 2 câmeras de 12MP e 5MP, enquanto sua frontal, possui uma câmera de 8MP, que vão capturar seus momentos com muito mais resolução e qualidade. Se você gosta de utilizar ao maxímo do seu smartphone, vai ficar de boca aberta com o processador Octa-core do Moto Z3 Play, que permite que você realize várias tarefas em segundo plano, ou jogue games pesados com alto desempenho e fluidez, e tudo isso somado a sua incrível memória de 64GB que não vai deixar faltar espaço para suas fotos, videos e aplicativos que você ama."
26207;CAMERA DIGITAL DSC WX7 L 3D                  ;014621;[]
26335;TABLET NB193 HIBRIDO 8.9 WIND Q.CORE PT      ;021759;[]
27792;"TELEVISOR SMART 50"" P6US ULTRA HD 4K HDR SEMP";026344;"A imaginação ganha qualidade 4K UHD com sofisticação em design e a inteligência de ter o que mais gosta em um clique. A TCL P6 oferece o que há de mais novo em imagem com o melhor do entretenimento, em um design moderno e sofisticado para você explorar com a família e amigos. Com a tecnologia Hight Dynamic Range (HDR) seus conteúdos ganharão mais vida e intensidade. Ela oferece um padrão superior de contraste e brilho, exibindo muito mais detalhes da imagem, mais próxima da realidade e cores mais vivas.4K de qualidade não possuí pixel branco. A P6 reproduz cores mais vivas e brilho de verdade em todos os seus mais de 8 milhões de pixels, vermelhos, verdes e azuis.Design moderno e arrojado, com borda fina para valorizar ainda mais as belíssimas imagens da sua TV."
27800;MINI SYSTEM MHC-GT5D SONY                    ;023380;"O Mini system MHC-GT5D é um novo conceito em áudio. Possui um subwoofer e uma barra, permitindo ser conectado à TV, além de contar com leitor de DVD, o que melhora ainda mais a qualidade de som dos filmes, documentários e shows que você for assitir. é fácil de transportar, podendo ser levado para ambientes externos e animar muito mais seus churrascos e festas, pois possui rodinhas para um fácil transporte. Com a nova tecnologia Sound Pressure Horn, a pressão sonora fica incomparável, além de oferecer batidas fortes, ótima qualidade dos sons graves, e economizar energia (comparado aos modelos de 2014). Traz Led Multicolorido que ilumina conforme a batida da música."
27848;CAMERA DIGITAL DSC TF1 PRETA SONY            ;017923;[]
28148;"TELEVISOR SMART 40"" PH40U21DSGW PHILCO       ";023338;[]
28404;CAMERA DIGITAL DSC TF1 VERMELHA SONY         ;017924;[]
28488;"TELEVISOR SMART 43"" 43LJ5550 LG              ";024373;"Smart TV LED 43&rdquo; LG 43LJ5550 webOS - Conversor Digital 1 USB 2 HDMI<br />\\nTodos os televisores LG já vem com conversor digital integrado, pra você curtir seus conteúdos com altíssima qualidade! Assista aos seus conteúdos em alta definição (768p e 1080p) através das conexões HDMI e USB*. Conecte um Blu-ray, TV à cabo, videogame ou pen drive com filmes e curta a melhor qualidade de imagem! webOS 3.5: conteúdo rápido e fácil.<br />\\nCom webOS 3.5. mergulhe em um mundo ilimitado de conteúdo premium dos maiores e mais populares provedores de entretenimento do mundo.', '* A interface gráfica do webOS pode variar de acordo com o país. * Os serviços estão sujeitos à disponibilidade e podem exigir assinatura, podendo variar conforme a plataforma e o produto. é necessária uma conexão com a internet.', 'LG webOS 3.5, um sistema seguro e confiável<br />\\nO sistema de segurança do webOS 3.5 é certificado pelo Programa de Cybersegurança UL (CAP2900-1) e proporciona uma experiência segura para você e sua família. Ele previne a instalação não autorizada de aplicativos, ataques, invasões e possíveis problemas que possam comprometer a sua privacidade.', 'Full HD LED TV: experiência 2x melhor que TVs HDs<br />\\nFull HD LED TVs possuem o dobro da resolução das TVs HDs, reproduzindo imagens mais naturais em telas maiores. Com detalhes são mais ricos, cores mais vivas, apresentando imagens impressionantes em sua TV, oltimização de todas as cores de uma maneira única, o processamento exclusivo da TV LG não só melhora as cores, mas também ajusta a luminosidade, o matiz e a saturação de cor. As cores ganham vida com mais intensidade e profundidade, Full HD LED TV Upscaling, o Upscaling Full HD da LG aprimora para uma qualidade de imagem próxima à 1080p através dos mais avançados processadores de imagem, surpreenda-se com o Virtual Surround Plus, Virtual Surround Plus melhora a qualidade do áudio para uma experiência sonora imersiva. A performance do som faz você se sentir como se estivesse em um show ou em um estúdio de gravação, seus programas na hora que você quiser, a função Time Machine Ready permite que você grave* os conteúdos da TV aberta digital para assistir quando quiser."
28659;PULSO ACO PULSEIRA ACO QZ TECHNOS 2117LAH/1B ;024114;[]
28907;SMARTPHONE SAMSUNG GAL A20  A205 32GB AZUL   ;026004;" O Galaxy A20  é um smartphone para quem não abre mão de imagens de qualidade, ele vem com um display infinito de 6,4 polegadas com a tecnologia Super Amoled Full HD+ para você jogar, assistir vídeos e séries favoritas em alta qualidade de imagem. Suas câmeras, traseira de 13MP + 5MP e a de selfie de 8MP possibilitam que você tire fotos incríveis com muito mais amplitude no modo ultra-wide. E para que você não se preocupe com a segurança dos seus dados ele vem com sensor de impressão digital para que apenas pessoas com a digital cadastrada possa desbloquear seu aparelho. O processador octa core de 1.6 Ghz somado a memória RAM de 3GB, evita aqueles travamentos indesejáveis, te proporcionando uma ótima experiência. E para você ficar conectado o dia todo o Galaxy A20 ainda conta com uma bateria de 4000mAh.', '', '', '"
29093;SMARTPHONE APPLE IPHONE 6S 16GB DB GOLD      ;025099;"O iPhone 6S está com uma tela maior e nova tecnologia para aprimorar ainda mais sua experiência visual. Você vai se impressionar com sua tela Retina HD com 4,7 polegadas, ela tem pixels com a tecnologia Dual-Domain. Fotos e vídeos ficam mais realistas, mesmo de ângulos de visualização mais amplos e usa luz ultravioleta para posicionar de forma precisa os cristais líquidos na tela. Os cristais com melhor alinhamento proporcionam uma qualidade visual incrível, com pretos mais profundos e texto mais nítido."
29697;ANTENA + RECEPTOR SKY PRE PAGO 60CM PT/CZ    ;025480;"Sky pré-pago é a TV que você recarrega como um celular, sem fatura, sem mensalidade e sem multa.<br />\\né só comprar o equipamento e recarregar com o seu pacote de canais favorito. E mais: você pode fazer suas recargas e variar seu pacote de canais quando quiser!<br />\\nCompre o equipamento e recarregue quando quiser."
29926;TABLET NB274 M7S PLUS 8GB AZUL               ;026053;"O tablet M7S Plus da Multilaser é versátil, moderno e perfeito para o seu dia a dia. A tela de 7 polegadas tem a nitidez e o brilho ideal para deixar sua produtividade mais agradável. O Android 7.0 é leve e roda bem no processador Quad Core 1.3GHz. A capacidade de 8GB memória interna, expansível até 32GB através de cartão micro SD (não incluso).<br />\\nAssista vídeos, escute as suas músicas favoritas, desenvolva a sua criatividade, tenha momentos de entretenimento e educação com o tablet que vem acompanhado do sistema operacional Android 7.0 que permite turbinar seu tablet com milhares de aplicativos no Google Play. Tire selfies com a câmera frontal 1.3MP, tire fotos e grave vídeos também com a câmera traseira 2.0MP. Acompanha 1 cabo micro USB e 1 carregador. Possui conexão wi-fi (150mbps) e bluetooth para você sempre ficar conectado. Conta com 1GB de Ram e 8GB de armazenamento para te oferece um desempenho ainda mais potente e eficiente."
31028;CELULAR INFINITY W201 PRETO                  ;026222;"O Infinity W201 é um celular, simples porém com design moderno, ele vai te surpreender pois conta com vários recursos como Rádio FM, Bluetooth, entrada para cartão micro SD e 2 chips, tela grande quando comparado a celulares da  categoria e ainda possui antena rural, própria para lugares onde o sinal das operadoras não chegam muito bem.   "
31052;PEN DRIVE 16GB MC112 3X1 ADAPTADOR SD        ;020964;"O Cartão Micro SD Multilaser é 3 em 1, pois além do cartão, conta com adaptador SD e um leitor USB para o cartão. Com capacidade de até 16GB, oferece maior flexibilidade e segurança para seus dados. "
32016;RECEPTOR ANALOGICO BEDINSAT BS2000           ;020796;"O receptor Bedinsat BS2000 sintoniza mais de 30 canais analógicos de TV aberta. Também canais de rádio disponíveis. O menu é de simples e fácil operação, proporciona ao consumidor final agilidade e facilidade no desempenho do aparelho. - áudio Duplo - Tecla Monoponto/Multiponto no controle remoto - 4 canais favoritos no controle remoto - Relógio no Display - Fonte com chaveamento automático de tensão - Recepção de canais de áudio - Opção Reset (Restaurar padrão de fábrica) - Teclado multifunção no painel frontal - Mostra frequência no display - Menu com código de acesso (MENU+99) - Função timer (Desligamento automático do aparelho) - Não contém saída de RF - Entradas: LNBF 75 Ohms e Antena Local 75 Ohms - Sistema de TV: PAL-M"
