id;NOME_PRODUTO;CODE;DESCRIPTION
4609;PEN DRIVE 8GB PD587 TWIST PRETO              ;019729;"Armazene seus dados mais importantes de forma totalmente segura com os pen drives da Multilaser. Com um design compacto, você pode levar seus documentos, músicas e fotos para onde quiser. Pen drive com capacidade de 8GB que armazena aproximadamente 2.000 músicas, 4.000 fotos ou 200 minutos de vídeo. Mais praticidade para você.', '&bull; Compatível: Mac OS 9.0 e superiores/ Windows 98 e superiores  Taxas de transmissão de dados: 3 MB/s (gravação) e 10 MB/s (leitura)  Conexão USB 2.0: DC 5V"
4637;RADIO RECEPTOR 2 FXS RM PFT22AC              ;019525;" O Rádio Motobrás RM PFT 22AC é perfeito para quem busca praticidade na hora de ouvir músicas. Compacto e charmoso ocupa pouco espaço sendo possível levá-lo a qualquer lugar, pois o mesmo é portátil.   Leve, prático e com uma ótima qualidade de som, o RM PFT 22AC sintoniza as estações AM e FM, e possui potência de saída de 1w<br />\\nMais do que facilidade e qualidade, o Rádio RM PFT 22AC garante a versatilidade no seu uso diário. Você pode carregá-lo a onde quiser através da alça retrátil."
4834;CAIXA AMPLIFICADA CM-11 MULT CONECT PARTY BIV;025767;"A Caixa Amplificada Multuso Conect Party da Mondial é ideal para você que aprecia som de qualidade e mixagens eletrizantes, suas festas e reuniões com amigos e família nunca mais serão as mesmas. Esta incrível e sofisticada caixa amplificada possui a incrível função, cartão micro SD ou conexão Dual Bluetooth que permite a conexão simultânea de 2 smartphones , ele também possui entrada auxiliar, entrada para microfone e guitarra, display digital, potência de 400W RMS, bateria interna e recarregável além de ser bivolt. Compatível com guitarra, violão, teclado, computador, notebook, aparelho televisor, aparelho MP3/MP4, celular, retroprojetor e com suas alça e rodas para facilitar o transporte você pode levar a Caixa Amplificadora Multuso Conect Party para qual quer lugar e agitar com a galera. Mondial Sua melhor escolha!"
4884;CAIXA BLUETOOTH BS05B 5W SEMP TCL            ;026329;"A caixa de som bluetooth TCL BS05B promete deixar sua reunião com amigos muito mais divertida, afinal uma festa sem música não é festa. Faça chuva ou faça sol, ela estará lá tocando os hits do momento e proporcionando momentos únicos entre você e seus amigos.', 'Com uma bateria que garante até oito horas de funcionamento, a caixinha de som com bluetooth TCL BS05B possui um design compacto e moderno, com acabamento em tecido e borracha.', 'Com alta durabilidade, ela irá te acompanhar da hora de tomar um banho ouvindo música ou mesmo na piscina. Sabe por quê? A caixa de som bluetooth TCL BS05B é a prova d&rsquo; água.', 'Graças à sua tecnologia premium, o speaker permite que você atenda as chamadas de seu celular, mesmo à distância. Com a Caixa de Som Bluetooth Tcl BS05B Você também poderá se divertir com sua playlist até debaixo d&rsquo;água com muito mais qualidade e fidelidade de som."
4893;SMARTPHONE SAMSUNG GAL J4 J400 32GB DB PRATA ;025269;"O Galaxy J4 tem ampla tela HD de 5,5&rdquo; com excelente qualidade de contraste, apresentando aos usuários imagens super-realistas com sua tecnologia Super Amoled, agora você pode curtir seu conteúdo multimídia favorito em cores vivas e naturais. Agradável até no toque. e com contorno que se encaixa nas mãos, ele foi desenhado para proporcionar conforto, conveniência e sofisticação, escolha uma de suas quatro elegantes cores para combinar com seu estilo: preto e prata. Suas câmeras te oferecem belas fotos, com sua câmera traseira de 13MP e sua frontal de 5MP, vão capturar todos os seus momentos especiais com qualidade e nitidez. Personalize a forma como você conversa. O Galaxy J4 permite configurar duas contas para o mesmo aplicativo de mensagens com propósitos diferentes. O usuário pode instalar e gerenciar com facilidade a segunda conta simultaneamente através da tela inicial e do menu de configurações. Mais espaço para armazenar o que vale a pena guardar, ele vem com até 15 GB de capacidade de armazenamento no Samsung Cloud, assim, você pode manter seu conteúdo em segurança e à mão sempre que precisar. Conheça seu gerenciador de saúde pessoal e mantenha um equilíbrio perfeito em sua vida, ele conta com o Samsung Health, que monitora seus níveis de atividade, hábitos de nutrição e padrões de sono; tudo em um local seguro e conveniente para acesso rápido e fácil. A Pasta Segura da Samsung é uma solução de segurança eficaz que lhe permite criar um espaço privado e totalmente criptografado para armazenar conteúdo como fotos, documentos e arquivos de vídeo sob uma camada proteção adicional. Com uma bateria de 3000mAh, o J4 te acompanha durante todo o dia, para você ter liberdade e conforto, sem se preocupar em recarregar."
4947;PEN DRIVE 8GB PD687 TWIST ROSA               ;015558;"Armazene suas fotos, músicas, planilhas, entre outros documentos com mais qualidade e segurança. é a Multilaser pensando em sua comodidade proporciona praticidade em seu dia a dia com esse Pen Drive Twist 2 de 8GB! é só conectar em seu PC ou Notebook e pronto, já transfere tudo com mais agilidade e estilo, aproveite!"
4962;RADIO NBX-06 CONECT STAR MONDIAL             ;019634;"O Rádio Portátil Mondial NBX-06 possui entrada USB e auxiliar e sintoniza estações de rádio FM. Com potência de 3,4W RMS e 6 níveis de equalização, este aparelho pode ser utilizado como amplificador de potência de áudio de aparelhos de televisão, MP3 Players e similares que sejam projetados para conexão através de cabo P2. Com a função Auto Memory é possivel salvar até 60 estações na memória do rádio portátil."
4980;"TELEVISOR SMART 55"" 4K UN55NU7400 SAMSUNG    ";025185;"Com tela de 55 polegadas, design sofisticado sem fios aparentes e controle remoto único, a Smart TV Samsung 55NU7400 redefine a experiência de assistir TV. Ela possui a melhor qualidade de imagem, graças a sua resolução 4K genuína, que entrega uma imagem mais realista e uma imersão em cores e contraste. <br />\\nAproveite seus filmes com a máxima intensidade e encontre todos os detalhes que costumavam ficar escondidos em sombras escuras ou no brilho dos brancos através da inovação HDR Premium, oferecendo sensação de profundidade nas imagens, trazendo mais realismo aos filmes e séries independente de muita ou pouca iluminação no ambiente. <br />\\nCom um controle único você navega pelos canais da TV, conteúdos, configurações e muito mais. Se preferir, pode controlar as funções através do através do aplicativoSmartThings e transforme sua TV na central de automação da sua casa. <br />\\nAlém disso, você também pode usar o microfone do controle remoto da NU7400 para buscar conteúdos no Youtube ou Google, trocar de canal, abrir aplicativos ou mesmo consultar o clima. Tudo isso, em português!"
5003;MEGA DRIVE 22 JOGOS TECTOY                   ;024278;"Mega Drive: o clássico está de volta! Pela primeira vez no Brasil um vídeo game é relançado atendendo a pedidos e fazendo a felicidade dos milhares de fãs. O vídeo game está completo, com seu design clássico, joystick original de três botões, compatível com cartuchos originais, entrada para SD Card e 22 jogos inesquecíveis. Para quem gosta e é fã de vídeo game, não pode deixar de participar deste momento histórico e adquirir o seu."
5060;HOME THEATER HT-12 MONDIAL                   ;025780;"Home Theater  Multi Home FM II é muito moderno e é equipado com rádio FM estéreo, entrada USB, entrada para conectar cartão de memória Sd card e USB, saída digital com alta qualidade de som e imagem, sistema de áudio com entrada para 5.1 canais Controle de volume independente para subwoofer e canal central, controle remoto para todas as funções. Alto desempenho e baixo consumo, tudo para o seu conforto. Mondial, Sua melhor escolha."
5066;RADIO AE1500X/78 PHILIPS                     ;021874;"Entrada para fone de ouvido estéreo para aproveitar melhor as músicas Conecte seu fone de ouvido a este aparelho Philips para ouvir músicas de acordo com sua preferência quando quiser. Você pode curtir suas músicas favoritas com excelente qualidade de som sem incomodar as outras pessoas ao conectar seu fone de ouvido a esse aparelho."
5172;SMARTPHONE MOTOROLA MOTO G6 XT1925-3 INDIGO  ;024916;" A Motorola sempre traz modelos inovadores e modernos em suas linhas, e com O Moto G6 32 GB não é diferente pois é um smartphone incrível, seu design elegante e aderente, o faz  perfeito para a palma da sua mão. Para você assistir seus vídeos ou séries favoritas, ele conta com uma tela de 5.7&quot; Full HD+, que te fará embarcar numa experiência mais imersiva e envolvente. Sua câmera traseira de 12MP + 5MP e sua câmera frontal de 8MP ambas com flash LED vão registrar os momentos mais incríveis da sua vida com muito mais qualidade. Para você ter uma boa experiência com os recursos, ele conta com um processador octa core de 1.8 Ghz somado a memória RAM de 3GB e a sua memória de armazenamento de 32GB é expansível até 252GB através da entrada micro SD. ', '', '', '  "
5182;MINI SYSTEM PH470BT  PHILCO                  ;023432;"A Philco desenvolveu o Mini System PH470BT para suprir a necessidade de seus consumidores mais exigentes. é um modelo bivolt com entrada auxiliar, porta USB e tecnologia Bluetooth, que permitem que o usuário reproduza músicas em MP3 ou WMA armazenadas em dispositivos compatíveis. O produto tem 400 Watts RMS de potência e inclui 2 caixas acústicas."
5267;CAIXA ACUSTICA PHT80 PHILCO                  ;021891;"Aumente o som, pois a batida da sua música preferida vai começar! A Caixa Acústica Philco PHT80 USB Bluetooth Bivolt 80W é portátil com 2 tipos de alça para transporte, fácil e prática. Conta com entrada USB para reprodução de músicas, bluetooth que permite ouvir músicas armazenadas no celular e potência de 80W RMS. <br />\\nA Caixa Acústica da Philco possui entradas para microfone e guitarra com controle de volume, bateria recarregável interna com ótima duração, led indicador de carga de bateria (bateria fraca e carga completa), display LCD e entrada USB que reproduz arquivos de músicas a partir de uma conexão USB."
5276;CELULAR INFINITY W101 DB PRETO-VERMELHO      ;022726;"Use 2 Chips de qualquer operadora, rádio FM com antena interna. Ouça suas<br />\\nrádios favoritas sem precisar de fones, super Lanterna com fácil acesso, entrada padrão de fone de ouvido de 3.5mm."
5574;CASE E SUP.BO197 C  ALCA P TABLET PT ATE 7 po;021464;"Projeta seu aparelho contra poeira, arranhões e pequenos impactos: Com a Capa para Tablet da Multilaser, você poderá carregar o seu portátil com mais praticidade e segurança! Ideal para transportar tablets de até 7 polegadas, a Capa para Tablet oferece proteção completa com muito estilo e elegância. Com design exclusivo, possui alça ajustável e confortável.  "
5591;RADIO AUTOMOTIVO P3322 BLUETOOTH             ;024475;"Som Automotivo Bluetooth P3322 possui conexão USB, display iluminado, memoria para estação de radio e a qualidade que a Multilaser oferece."
5648;AUTO RADIO DEH 1380 MP T.D.LASER             ;014047;[]
5736;SMARTPHONE SAMSUNG GAL J7 PRIME TV 2 DB PT   ;025087;" O Galaxy J7 Prime2 TV conta com acabamento em metal e design ergonômico, que equilibram beleza e funcionalidade, sua traseira curva possui uma câmera sem nenhuma saliência, tornando fácil o seu manuseio em uma única mão. Com as câmeras de 13MP frontal e traseira de alta resolução e com diversos efeitos, como o Foco da Selfie que destaca os objetos em primeiro plano, capture os melhores momentos de sua vida. Para que não falte espaço para armazenar os seus arquivos você conta com 15GB grátis na nuvem por meio do Samsung cloud, além disso possui HDTV para que você assista seus programas favoritos em qualquer lugar. ', '', '', '"
5749;SMARTPHONE SAMSUNG GAL J7 PRIME TV 2 DB DR   ;025088;" O Galaxy J7 Prime2 TV conta com acabamento em metal e design ergonômico, que equilibram beleza e funcionalidade. Sua traseira curva possui uma câmera sem nenhuma saliência, tornando fácil o seu manuseio em uma única mão. Com as câmeras de 13MP frontal e traseira de alta resolução e com diversos efeitos, como o Foco da Selfie que destaca os objetos em primeiro plano, capture os melhores momentos de sua vida. Para que não falte espaço para armazenar os seus arquivos você conta com 15GB grátis na nuvem por meio do Samsung cloud, Além disso possui HDTV para que você assista seus programas favoritos em qualquer lugar. ', '', '', '"
5845;SMARTPHONE SAMSUNG GAL A50 A505 128GB PRETO  ;026484;"       O Galaxy A50 vai te surpreender, pois possui 128GB de armazenamento para você usufruir quantos aplicativos e arquivos favoritos quiser. Ele possui uma tela infinita de 6.4&quot; Super Amoled com resolução Full HD+, para você assistir seus filmes, séries e demais conteúdos em alta qualidade de imagem. Seu visual é especial, seja nas cores preta, branca ou azul e seus cantos arredondados proporcionam maior comodidade no seu dia a dia. A autenticação biométrica de alta tecnologia através do leitor de impressão digital na tela, reconhece apenas as digitais cadastradas, podendo ser as suas e outras de pessoas de sua confiança, para que você tenha maior segurança e desbloqueie facilmente com um único movimento. ', '', '', '', '', '       Pronto para tirar fotos como um profissional? O A50 vem com três câmeras incríveis de 25MP + 8MP + 5MP, com efeito ultra wide que expande seu campo de visão e modo retrato, focando somente no que te interessa no momento. Com a câmera frontal de 25MP, capture suas selfies com muito mais qualidade e estilo. Com processador Octa core de 2.3 Ghz, juntamente com sua memória RAM de 4GB, você aproveitar suas redes sociais, jogos e demais tarefas com muito mais fluidez e agilidade. Tudo isso por muito mais tempo, pois ele possui uma bateria de 4000mAh que garante o dia todo sem precisar de carga.', '', '', '"
5878;SUPORTE UNIX UNI 100                         ;021196;"Indicado para TVs Plasma/3D/LCD/LED com peso até 100kg e compatíveis com padrão de fixação VESA 75, VESA 400, VESA 600, VESA 800, VESA 100, VESA 200 normalmente encontrado em televisores de 14 a 84&quot;. Os Suportes Fixos para telas de pequeno/médio/grande porte são discretos, práticos e seguros, garantindo total sustentação do televisor. Com perfil slim (distância reduzida da parede), estão em sintonia com a tendência de telas cada vez mais finas."
6080;SMARTPHONE SAMSUNG GAL A30 A305 64GB PRETO   ;026006;" O Galaxy A30 possibilita que você veja mais além com o Display Infinito de 6,4 polegadas de ponta a ponta e a qualidade de tela Super Amoled Full HD+. Para a segurança dos seus dados ele conta com sensor de impressão digital na traseira. Com sua Câmera dupla de 16mp + 5MP, capture o seu mundo de forma mais ampla no modo ultra-wide e tire ótimas selfies com sua câmera frontal de 16 MP. Com processador Octa core de 1.8 Ghz somado a RAM de 4GB o Galaxy A30 consegue realizar várias tarefas ao mesmo tempo sem travamentos. A sua memória interna de 64GB guarda todos os arquivos, mídias e aplicativos que quiser sem se preocupar com baixo armazenamento. Recarregue e vá mais longe com uma bateria de 4.000mAh pronta para durar o dia todo e caso precise de uma carga extra você ainda conta com um carregador de 15W com carregamento rápido para que você não perder tempo.', '', '', '"
6084;TABLET NB733 MINI MS50X AZUL/PRETO           ;025436;"O Smartphone Nb733 Mini Ms50X Azul PretoNB733 te surpreenderá,mais leve, rápido e seguro do que nunca, para que você possa curtir ainda mais as suas fotos, vídeos, músicas, redes sociais e tudo mais que for importante para você."
6127;SUPORTE P TV LCD SBRP 111                    ;018247;"Suporte Ultra Slim para deixar sua TV bem próximo da parede como um quadro. Já vem montado e é ideal para TVs de 23? a 37&rdquo; com até 35 kg."
6261;TABLET NB224 M7 3G QUAD.CORE 7P 2CHIPS BR    ;022061;[]
6274;BOX LINE OCM 3912 ONEAL                      ;024524;"As caixas multiuso Ocm3912 foram projetadas dentro do que há de mais rigoroso e atual em componentes, medições e testes em áudio. Seu dissipador é super dimensionado, podendo atuar em locais de trabalho com temperatura ambiente elevadíssima. Possui os seguintes recursos: Controle de grave, médio e agudo; 2 canais de entrada com volumes independentes; o canal 1 possui: 2 entradas para microfone e violão e controle de volume para as entradas P10 1/4&rdquo; ; o canal 2 possui: 1 entrada auxiliar RCA Cd/Dvd (Cd Player, Dvd, Mp3-4 etc.), MP3/WMA Player com rádio FM , porta USB, entrada para cartão SD e Bluetooth."
6413;SMARTPHONE LG K10 POWER DB TITANIUM          ;023576;" O LG K10 Power é um modelo que se destaca entre vários outros smartphones, principalmente pela sua potente bateria de 4400 mAh, que te garante o dia todo de uso e um pouco mais, ainda possui uma tela incrível de 5.5&quot; polegadas HD, para desfrutar ainda mais dos seus conteúdos multimídia. Com memória de 32GB para você não se preocupar em apagar aplicativos e arquivos, te dando mais conforto na sua experiência com o smartphone. E pensa que acabou? Assista seus programas de TV onde estiver, o K10 Power tem HDTV para você não perder sua novela, telejornal ou filme favorito.', '', '', '"
6466;"TELEVISOR SMART 49"" 4K KDL-49X705E SONY      ";024483;"Ainda não está convencido de que chegou a hora de ter uma Smart TV 4K? A sua chance é agora. Veja filmes, séries, esportes e jogue videogame com sons e imagens fantásticas na Smart TV LED 49&quot; HDR Ultra HD 4K Sony KD-49X705E BR6.', 'O aparelho possui tecnologia HDR 4K, que lhe permite a melhor experiência com vídeos e fotos, deixando as imagens mais reais. A tela de 49 polegadas é ideal para aqueles que gostam de equipamentos imponentes ou possuem bastante espaço na sala ou no quarto.', 'E, como Smart TV, ela realiza conexão Wi-Fi e acessa o YouTube&trade; para você curtir seus vídeos e canais preferidos com 4 vezes mais qualidade, uma experiência imersiva proporcionada pela 4K."
6531;"TELEVISOR SMART 43"" UN43J5200 SAMSUNG        ";023902;"<span style=\\""font-size:13.5pt\\""><span style=\\""font-family:&quot;Times New Roman&quot;,serif\\""><span style=\\""font-size:11.0pt\\""><span style=\\""font-family:&quot;Calibri&quot;,&quot;sans-serif&quot;\\""><span style=\\""color:black\\""><span style=\\""font-weight:normal\\"">Desfrute de um nível de realismo de entretenimento em casa maior do que nunca. Graças a uma resolução duas vezes maior do que as de TVs HD normais, a <span style=\\""border:none windowtext 1.0pt; padding:0cm\\"">Samsung ', '', '', '', '', '<span style=\\""font-size:11.0pt\\""><span style=\\""font-family:&quot;Calibri&quot;,&quot;sans-serif&quot;\\""><span style=\\""color:#414141\\""><span style=\\""font-weight:normal\\"">Un43J5200 ', '', '', '', '', '', '<span style=\\""font-size:11pt\\""><span style=\\""line-height:21.0pt\\""><span style=\\""vertical-align:baseline\\""><span style=\\""font-family:Calibri,sans-serif\\""><span style=\\""border:none windowtext 1.0pt; color:black; padding:0cm\\"">FHD TV', '<span style=\\""color:black\\""> oferece uma experiência visual de tirar o fôlego que o leva para além da tela em um mundo de imersão total. Com a textura rica e viva das imagens em Full HD, seus programas de TV e filmes favoritos nunca mais serão os mesmos. Descubra a realidade com uma experiência completa de alta definição.', '', '', '', '', '', '\\n\\n<p style=\\""margin-bottom: 13px;\\""><span style=\\""font-size:11pt\\""><span style=\\""line-height:21.0pt\\""><span style=\\""vertical-align:baseline\\""><span style=\\""font-family:Calibri,sans-serif\\""><span style=\\""color:black\\"">Usando um algoritmo avançado de melhoria da qualidade de imagem, o Wide Color Enhancer Plus da Samsung melhora consideravelmente a qualidade de qualquer imagem e revela detalhes ocultos. Com o Wide Color Enhancer Plus, agora você verá as cores como elas realmente devem ser vistas. ', '', '', '', '', '<span style=\\""font-size:11pt\\""><span style=\\""background:white\\""><span style=\\""line-height:21.0pt\\""><span style=\\""vertical-align:baseline\\""><span style=\\""font-family:Calibri,sans-serif\\""><span style=\\""color:black\\"">Com o ConnectShare Movie, basta você conectar uma unidade de memória USB ou uma unidade de disco rígido à smart TV e desfrutar instantaneamente de filmes, fotos ou músicas. Agora, você poderá desfrutar de uma grande variedade de conteúdos confortavelmente na TV de sua sala de estar.', '', '', '', '', '', '', '\\n\\n<p style=\\""margin-bottom: 13px;\\""><span style=\\""font-size:11pt\\""><span style=\\""line-height:21.0pt\\""><span style=\\""vertical-align:baseline\\""><span style=\\""font-family:Calibri,sans-serif\\""><span style=\\""color:black\\"">Equipada com os principais tipos de conexões para facilitar a ligação com os mais variados tipos de equipamentos', '', '', '', '', '"
6579;MINI SYSTEM PH600BT PHILCO                   ;023430;"Traga mais música para o seu dia. Este mini system tem tudo o que você precisa. Ele reproduz CD, como também conta com entrada USB, para plugar seu pen drive escutar suas músicas prediletas direto no aparelho. Tem o diferencial da tecnologia bluetooth, no qual você irá passar seus arquivo de áudio do smartphone, tablet para o aparelho sem usar fios, muito mais prático. E ainda tem entrada para microfone e vem com controle remoto."
6650;SMARTPHONE LG K10 POWER DB DOURADO           ;023631;" O LG K10 Power é um modelo que se destaca entre vários outros smartphones, principalmente pela sua potente bateria de 4400 mAh, que te garante o dia todo de uso e um pouco mais, ainda possui uma tela incrível de 5.5&quot; polegadas HD, para desfrutar ainda mais dos seus conteúdos multimídia. Com memória de 32GB para você não se preocupar em apagar aplicativos e arquivos, te dando mais conforto na sua experiência com o smartphone. E pensa que acabou? Assista seus programas de TV onde estiver, o K10 Power tem HDTV para você não perder sua novela, telejornal ou filme favorito.', '', '', '"
6721;CELULAR BLU TANK II T193 DB BRANCO ROSA      ;022174;"O Blu Tank II possui câmera VGA e flash LED, você poderá capturar todos os seus momentos em fotos ou vídeos, e graças a sua tecnologia Bluetooth você poderá compartilhá-los com seus entes queridos.  Reproduz MP3/MP4 para música e vídeo. Rádio FM para sintonizar as suas estacoes de rádio favoritas. Você estará sempre atualizado com o mundo ao seu redor."
6904;CELULAR BLU TANK II T193 DB PRETO AMARELO    ;022175;"O Blu Tank II possui câmera VGA e flash LED, você poderá capturar todos os seus momentos em fotos ou vídeos, e graças a sua tecnologia Bluetooth você poderá compartilhá-los com seus entes queridos.  Reproduz MP3/MP4 para música e vídeo. Rádio FM para sintonizar as suas estacoes de rádio favoritas. Você estará sempre atualizado com o mundo ao seu redor."
7007;"TELEVISOR SMART 32"" 32LJ600B LG              ";024372;" ', 'A LG 32LJ600B possui qualidade de imagem e som surpreendentes. Com os recursos da plataforma Smart WebOS 3.5 você acessa conteúdos em um painel rápido e intuitivo, são diversos aplicativos de filmes, séries, noticiários para deixar sua diversão completa. Com a função Music Player você pode escutar suas músicas e acompanhar a letra direto na tela da TV. Também é possível utilizar um *HD externo e gravar seu programas da TV aberta com o recurso Time Machine, basta programar o horário e a TV começa a fazer a gravação. Além disso, o modelo LG 32LJ600B conta com bordas metálicas, levando harmonia e elegância ao ambiente."
7026;"TELEVISOR SMART 43"" PTV43E60SN LED PHILCO    ";025738;"A TV Philco 43&quot; LED PTV43E60SN possui o aplicativo oficial da Netflix, diversão para toda família diretamente do seu televisor, é smart com wireless integrado, interatividade com programas de TVs digitais pelo controle remoto. Com dolby áudio, opção que garante a qualidade do som. Seus filmes prediletos com maior qualidade. Além de oferecer função midiacast, comunicação sem fio entre dispositivos móveis. Conta ainda com processador duo core e gráfico, proporcionando maior velocidade e performance para o seu televisor, a TV Philco 43&quot; LED PTV43E60SN  é a tecnologia que estava faltando na sua casa!"
7143;SMARTPHONE MOTOROLA MOTO G4 P DTV XT1603 PT  ;022367;"O Moto G4 Play é um smartphone compacto e completo, tire fotos nítidas com uma câmera traseira de 8 Mp, que também permite gravar vídeos em 1080p a 30 fps, e faça boas selfies com a câmera frontal de 5 Mp.<br />\\nDivirta-se sem perder o ritmo com o processador quad-core Qualcomm Snapdragon 410, que somando à uma memória RAM de 2 Gb, te permite usar vários aplicativos ao mesmo tempo sem perder velocidade. A bateria de 2800 mAh permite que você assista a vídeos, jogue e faça chamadas durante boa parte do dia, sem parar para carregar, e caso a bateria acabe, não se preocupe com o tempo de carga, o smartphone vem com carregador rápido de 10W que garante mais horas de uso com menos tempo na tomada."
