id;NOME_PRODUTO;CODE;DESCRIPTION
528;SMARTPHONE LG K50S 32GB AZUL                 ;026606;"A família de smartphones K da LG ganha mais um integrante, é o K50S, projetado para proporcionar uma experiência única e tornar sua rotina diária bem menos complicada, graças aos recursos embarcados com tecnologia de ponta como assistente virtual, que agora possui um botão específico, é só apertar o botão do Google Assistente na lateral do seu LG K50S para fazer pesquisas, mandar mensagens, ver o trânsito e muito mais.', 'Suas câmeras de última geração, com Inteligência Artificial, garantem fotos perfeitas. Você tem 3 lentes para tirar fotos: Câmera Principal de 13MP, Câmera Super Grande-Angular de 5MP e a câmera de profundidade de 2MP para criar visuais artísticos com efeito bokeh. A câmera frontal de 13MP também conta com a tecnologia de Inteligência Artificial e tem a função Modo Retrato para você dar um toque mais profissional às suas selfies.', 'Sua Tela HD+ FullVision de 6,5 polegadas oferece uma incrível qualidade de imagens, proporcionando uma visualização nítida e uma experiência visual mais viva e imersiva. Agora, além de ver com mais detalhes suas fotos e vídeos você pode acompanhar seus filmes e séries em uma super tela com proporção de 19:5:9.', 'Prepare-se para um som multidimensional que o LG K50S vai lhe proporcionar. Ao colocar qualquer fone de ouvido você é transportado para uma sala de cinema, são sons em todas as direções, assim como na vida real. Esta experiência sonora beirando ao mundo real só é possível graças a aprimorada tecnologia DTS:X, que faz com que o som se movimente ao seu redor, provocando a sensação de que você está no meio da história."
540;PEN DRIVE SONY R 16GB USMRGR                 ;022086;"Armazene seus arquivos mais importantes com segurança no Pen Drive USM16G da Sony. Com capacidade de 16GB você terá mais espaço para guarda suas fotos, musicas ou aquele trabalho importante. Discreto e fácil de usar, pode ser levado na bolsa, no bolso da calça ou mesmo dentro da carteira. Nenhum outro produto portátil é tão rápido e prático quanto esse dispositivo."
541;SMARTPHONE SAMSUNG GAL A51 128GB AZUL        ;026724;"O A51 possui um Display Infinito Full HD+ de 6.5&quot; com tecnologia Super AMOLED, para você poder jogar, assistir, navegar nos seus conteúdos favoritos sem interrupções e qualidade de som e imagem incríveis.   Uma câmera Quadrupla para te dar ainda mais opções! Tire fotos nítidas de alta resolução com a câmera principal de 48MP, tanto de dia quanto de noite. Uma câmera Ultra Wide de 123&deg; fotografa imagens mais amplas. Escolha a câmera Macro de 5 MP para tirar fotos de perto com alta definição, e destaque o objeto com os vários efeitos de Foco Dinâmico da câmera de profundidade de 5 MP.  Você precisa de um celular que aguente sua rotina. A bateria de 4.000 mAh permite que você faça transmissões ao vivo, compartilhe e jogue sem se preocupar. E se você ficar com pouca bateria, é só conectar e recarregar com o Carregamento Rápido de 15W, é mais bateria com menos tempo de carga.  O Galaxy A51 oferece um processamento rápido e grande espaço de armazenamento para você focar no agora. Um processador octa-core avançado e uma memória RAM de 4GB oferecem desempenho suave e eficiente para as tarefas e jogos mais pesados. Baixe mais e apague menos com 128GB de armazenamento interno. Ainda quer mais armazenamento? Adicione ainda mais com um cartão MicroSD de 512GB.  Mantenha seu smartphone seguro onde for. O Galaxy A51 vem com autenticação biométrica de alta tecnologia. O leitor de impressão digital na tela reconhece sua impressão digital única, para que só você possa desbloquear facilmente com um único movimento."
561;SMARTPHONE SAMSUNG GAL J6 32GB PRATA         ;025193;"O Samsung Galaxy J6 32GB traz consigo uma ampla tela de 5,6 polegadas com tecnologia Super Amoled e qualidade de resolução em FULL HD, proporcionando uma experiência com cores mais vivas, para você assistir suas programações favoritas em qualquer lugar através da tv digital, assistir vídeos e mandar bem nos seus games.  Além disso o smartphone dispõe do App Pair que possibilita a visualização de vídeos e aplicativos de mensagens simultaneamente, permitindo que você possa continuar assistindo série favorita enquanto responde as mensagens dos seus amigos. Para você registrar todos os momentos da sua vida, ele vem com câmera traseira de 13MP e uma de selfie de 8 MP, ambas com flash LED para deixar as suas fotos sempre nítidas. O seu processador octa core evita que ocorra travamentos durante o uso, enquanto que o seu amplo armazenamento de 32GB, expansível até 256 GB através da entrada micro SD, somados aos 15 GB de capacidade de armazenamento disponíveis no Samsung Cloud, faz com que você não precise ter que escolher entre seus aplicativos favoritos e suas fotos.', '', '', '', '', '"
570;PEN DRIVE MC163 2X1 LEITOR USB SD 32GB       ;025242;"O Pen Drive MC163 é feito para armazenar muito mais dos seus arquivos. Leve para qualquer lugar e salve fotos, músicas e vídeos. "
606;SMARTPHONE RIU EKO 4.0 PRETO                 ;025586;"Moderno e com um design que agrada pessoas com estilos diferentes, o Smartphone EKO 4.0 da RIU foi desenvolvido para oferecer alto rendimento. Equipado com processador Quad Core, ele também conta com uma ampla tela de 4 polegadas e possibilita o uso de dois números diferentes de telefone ao mesmo tempo."
638;KIT AUTOMOTIVO AU 953 MP3+4 ALTO FALANTES    ;023807;"Você encara o trânsito numa boa: é só plugar o seu pen drive ou smartphone com Android na entrada USB frontal para curtir suas playlists favoritas. Ele reproduz arquivos nos formatos MP3, USB, SD, MMC além de oferecer 4 auto falantes inclusos, tornando ele o melhor Kit Automotivo para o seu automóvel. "
658;CAPINHA LG K11                               ;026244;[]
670;"TELEVISOR SMART 43"" 4K UN43NU7100 SAMSUNG    ";025183;"Aproveite o melhor da resolução 4K em uma TV UHD Samsung - Com 4 vezes mais detalhes que a resolução Full HD a Samsung garante o melhor da tecnologia 4K com painéis &quot;RGB&quot; genuínos em suas TVs UHD. <br />\\n4K de verdade é Samsung: A NU7100 é certificada por importantes instituições internacionais e não tem pixel branco, que prejudica a qualidade da imagem. <br />\\nDesign Perfeito: Acabamentos precisos, bordas super finas e soluções para minimizar a exposição de fios no ambiente fazem da NU7100 uma TV elegante e completa em Design. <br />\\n4K de Verdade: A TV Samsung NU7100 garante o melhor da tecnologia UHD, com paineis RGB e com fidelidade de cores, sem sub-píxel branco. Certificada pelas principais associações internacionais do setor. <br />\\nHDR Premium: Muito mais brilho e contraste para você aproveitar seu programa tanto nas cenas mais escuras quanto naquelas de alta luminosidade. <br />\\nPoucos Cliques para um Mundo de Conteúdos - Tela de Cinema no Conforto da sua Sala: Veja cada cena ganhando vida, independente do tamanho da sua sala! <br />\\nTudo em uma Tela: Com um simples clique em seu controle remoto, acesse a tela inicial com seus aplicativos, canais de TV, dispositivos conectados e configurações."
685;SMARTOGO WI 317 PACK ECO.CABO MICRO USB C/NYL;023814;Smartogo Pack Economico Cabo Micro Usb Com Nylon 1,2m 40/cx - Wi317
686;SMARTOGO CB108 PACK ECO.CARREGADOR DE PAREDE ;023812;"Smartogo pack econômico carregador de parede 1 x usb', '', '', '"
688;"TELEVISOR SMART 50"" 50P65US ULTRA HD 4K      ";025718;"Bem vindo ao mundo 4K.<br />\\nEsplore o novo com qualidade de imagem e o melhor da tecnologia. A imersão nunca foi tão real!', 'A TCL P65 UHD 4K. Apresente aos amigos e à sua família uma nova visão de um mundo de possibilidades e tecnologia. "
704;CAIXA AMPLIFICADA MCO-09 MULTI CONNECT       ;026424;"A caixa de som amplificadora Multi Connect Thunder MCO-09 veio para turbinar a sua festa. Com ela, além de ter um som potente de 100W de RMS, conta com display digital e equalizador gráfico, para você ter maior facilidade na hora de configurar o som. O aparelho permite que você ouça músicas diretamente do seu smartphone, através do Bluetooth. Não perca mais tempo e turbine logo a sua festinha com este incrível produto!', '', '', '"
731;"TELEVISOR SMART 75"" UHD BT UN75RU7100 SAMSUNG";025907;" ', 'Invista em uma legítima Smart TV 4K Samsung UN75RU7100. Você vai se apaixonar pela tecnologia e inovação. Uma tela de cinema no conforto da sua casa, pois ela é em LED de 75&quot; com resolução Ultra HD e HDR Premium onde oferece um padrão superior de contraste e brilho, exibindo muito melhor os detalhes da imagem mais próxima da realidade, com cores mais vivas. Linda e moderna, com design Slim, seu acabamento é preciso e com bordas finas e soluções para minimizar a exposição dos fios no ambiente, basta passa-los usando as caneletas e a parte de traz dos pés, assim, vai deixar o visual mais organizado e clean. Com recursos inteligentes para tornar tudo mais prático no momento de lazer, a conexão sem fio entre TV e outros dispositivo vai fazer toda diferença na hora de escolher o conteúdo. Via Bluetooth, você pode conectar facilmente fone de ouvido, teclados, Soundbar e outros equipamentos compatíveis com este tipo de conexão. Ah, sem falar que seu sistema operacional é Tizen, e a conectividade se faz através de Wi-Fi e Bluetooth, conversor digital integrado e ainda possui 3 entradas HDMI e 2 USB. Perfeita, não é mesmo?! é a Samsung pensando o no sem bem estar e conforto.', ' ', ' "
738;RADIO RECEPTOR 7 FXS RM PFT73AC              ;019524;[]
741;TABLET NB275 M7S 3G PLUS 8GB ROSE            ;025782;[]
742;BOX LINE OPB 5060-X BLUETOOTH ONEAL          ;024670;"A caixa amplificada ONEAL mod. OPB5060 foi projetada dentro do que há de mais rigoroso e atual em componentes, medições e testes em áudio. Seu gabinete foi produzido em MDF, pintura em resina de alto impacto e tela de metal. Possui um sistema inédito de proteção térmica (ETP - Electronic Thermo-protection). Enquanto a maioria dos aparelhos utiliza relês e termostatos mecânicos, nossos aparelhos possuem este controle eletronicamente. Este sistema trabalha com menos de5%de tolerância de erros, já os sistemas convencionais operam com uma margem de tolerância aproximada de 30%; possui sistema de ventilação inteligente (ICS - Intelligent Cooler System), onde o sistema de turbo ventilação só é acionado com o aumento da temperatura em seu turbo dissipador que é super dimensionado, podendo atuar em locais de trabalho com temperatura ambiente elevadíssima. Possui os seguintes recursos: Suportes Fly; 2 entradas Line (215mV) paralelas (uma com Jack P10 &frac14; e uma XLR Balanceadas) com controle de volume;mbém conta com a função exclusiva de limitador duplo (DCL - Double Clip Limiter) que protege o aparelho de qualquer excesso de sinal que o mesmo receber, o limiter atuará instantaneamente, com o attack muito rápido. Este sistema de limitação não ceifa nenhuma frequência, nem dá a sensação de comprimir o som, problema comum nos limiters que se encontram no mercado. Para proteção dos alto-falantes na hora de ligar o sistema, possui AUTO RAMP (ARP - Auto Ramp Protection), o amplificador libera o áudio para os altofalantes em rampa crescente, protegendo-os de qualquer tipo de oscilação ou ruídos que possam danificá-los; Proteção contra Curto na saída (SCP - Short Circuit Protection); Tecla Turbo Loud; MP3/WMA Player com rádio FM e função REC, entrada USB, entrada para cartão SD e Bluetooth; controle de volume master; controles de graves médios e agudos e LEDsindicadores de clip, Signal e 0dB. Esta Powered Box tem resposta ampla de frequência, com níveis extremamente baixos de ruídos e distorção harmônica, proporcionando áudio puro, limpo e de alta fidelidade.   "
770;"TELEVISOR SMART 48"" KDL-48W655D SONY         ";023376;"Assista aos melhores conteúdos da internet com qualidade e rapidez com uma Smart Tv Sony de 48&quot;. A TV KDL-48W655D da Sony oferece a mais moderna tecnologia em imagem integrada a um design moderno e elegante, a função Smart TV possibilita o acesso aos melhores filmes, vídeos e músicas da internet. Tudo isso através da sua rede WI-FI, sem necessidade de cabos.  "
810;"TELEVISOR SMART 32"" TC32FS500B PANASONIC     ";025303;"Aproveite o melhor da Smart TV TC32FS500B, confira toda a sua programação preferida e tenha momentos de lazer com sua família ou amigos acessando vídeos, filmes, séries com os aplicativos do Youtube, Netflix e muito mais. Essa Smart TV oferece um processador Dual Core proporcionando rápida navegação na internet com o Web Browser. Você poderá reproduzir o conteúdo que preferir com o Media Player como fotos, vídeos e músicas com a conexão USB, sem contar nas duas entradas HDMI que é mais uma alternativa para conferir o que quiser. "
868;ROTEADOR RE058 150MBPS 1 ANT.4PTS.LAN        ;024850;"Compacto, discreto e elegante, o Roteador RE058 é a melhor opção para você que está procurando uma solução de wireless de internet ampla para sua residência ou escritório e com ótimo custo-benefício!"
879;SMARTPHONE LG K11 PLUS DB AZUL               ;025583;" O LG K11+ traz uma super tela HD de 5.3&quot; LCD IPS, que vai te fazer imergir na tela e aproveitar ainda mais. Com o seu design elegante e moderno, foi criado para quem busca estilo, beleza e durabilidade, pois além de possuir um design moderno ele também vem com a certificação MIL-SPEC STD-810G que garante sua durabilidade diante a diversas situações. Com a tampa traseira em metal, agrega uma proteção extra e maior resistência a impactos para manter o design estiloso do seu aparelho por mais tempo. ', '', '', '', '', '\\n\\n<p style=\\""margin-bottom:11px\\""><span style=\\""font-size:11pt\\""><span style=\\""line-height:normal\\""><span style=\\""font-family:Calibri,sans-serif\\"">Com as câmeras, traseira de 13MP e frontal de 5MP com foco ultra rápido, você captura todos os momentos que passam rapidamente por você e com o modo retrato você deixa o fundo desfocado focando somente naquilo que importa no momento, dando aspecto profissional às suas fotos. E Para você aproveitar ao máximo dos recursos sem ser interrompido com os travamentos   e com segurança, ele vem com processador Octa core de 1.5 Ghz somado a memória RAM de 3GB e interna de 32GB, permitindo que você jogue, assista filmes e séries sem precisar abrir mão dos seus arquivos e aplicativos favoritos e ainda conta com sensor de impressão digital para garantir segurança.', '', '', '"
908;CELULAR RIU FLIP 2.4 DB AZUL                 ;025662;" O Riu flip 2.4 é um celular simples e compacto, ideal para quem gosta de simplicidade, mas que não abre mão de se comunicar e ficar antenado. Ele possui entrada para dois chips, o que permite a combinação de dois números de telefone em um único dispositivo, possibilitando que você converse com seus amigos de operadoras distintas. Conta também com uma câmera com flash LED para capturar os melhores momentos da sua vida e compartilhar com seus amigos através de conexão Bluetooth. E para você ficar antenado com o que ocorre ao redor do mundo e saber como está seu time do coração nos campeonatos, ele conta com rádio FM, além disso permite que você ouça músicas e veja vídeos favoritos, pois suporta arquivos em MP3 e MP4.       ', '', '', '"
992;ROTEADOR RE057 150MBPS 1 ANT.4PTS.LAN        ;022506;"Compacto, discreto e elegante, o Roteador RE057 é a melhor opção para você que está procurando uma solução de wireless de internet ampla para sua residência ou escritório e com ótimo custo-benefício!"
1091;SMARTPHONE SAMSUNG GAL J6 32GB PRETO         ;025191;"O Samsung Galaxy J6 32GB traz consigo uma ampla tela de 5,6 polegadas com tecnologia Super Amoled e qualidade de resolução em FULL HD, proporcionando uma experiência com cores mais vivas, para você assistir suas programações favoritas em qualquer lugar através da tv digital, assistir vídeos e mandar bem nos seus games.  Além disso o smartphone dispõe do App Pair que possibilita a visualização de vídeos e aplicativos de mensagens simultaneamente, permitindo que você possa continuar assistindo série favorita enquanto responde as mensagens dos seus amigos. Para você registrar todos os momentos da sua vida, ele vem com câmera traseira de 13MP e uma de selfie de 8 MP, ambas com flash LED para deixar as suas fotos sempre nítidas. O seu processador octa core evita que ocorra travamentos durante o uso, enquanto que o seu amplo armazenamento de 32GB, expansível até 256 GB através da entrada micro SD, somados aos 15 GB de capacidade de armazenamento disponíveis no Samsung Cloud, faz com que você não precise ter que escolher entre seus aplicativos favoritos e suas fotos.', '', '', '', '', '"
1103;SMARTPHONE SAMSUNG GAL A71 128GB PRATA       ;026726;"O A71 é um smartphone cheio de tecnologias inovadoras que vão te impressionar. Seu Display tem resolução Full HD+ de 6.7&quot; com tecnologia Super AMOLED, que além de te dar cores mais vivas e nítidas, também ajuda na econômia de bateria com sua tecnologia que desliga automaticamente os pixels pretos numa imagem.', 'Mais Câmeras, mais opções! Tire fotos nítidas de alta resolução com a câmera principal de 64MP, tanto de dia quanto de noite. Uma câmera Ultra Wide de 123&deg; fotografa imagens mais amplas. Escolha a câmera Macro de 5 MP para tirar fotos de perto com mais detalhes, e destaque o objeto com os vários efeitos de Foco Dinâmico da câmera de profundidade de 5 MP. Tudo isso para você guardar seus momentos mais especiais da melhor forma.', 'O Galaxy A71 oferece um processamento rápido e grande espaço de armazenamento para você focar no agora. Um processador octa-core avançado e uma memória RAM de 6GB oferecem desempenho suave e eficiente. Baixe mais e apague menos com 128GB de armazenamento interno. Adicione ainda mais com um cartão MicroSD de 512GB. Com autenticação biométrica de alta tecnologia. O leitor de impressão digital na tela reconhece sua impressão digital única, para que só você possa desbloquear facilmente com um único movimento.  Você precisa de um celular que aguente sua rotina. E o A71 é a escolha certa! São 4500 mAh para você ficar o dia todo fora da tomada sem se preocupar com recarga. E se você ficar com pouca bateria, é só conectar e recarregar, com o carregamento super rápido do A71 você volta rapidamente à utilizar seu smartphone e todos os seus benefícios."
1104;CAIXA AMPLIFICADA MCO-07 MULTI CONNECT       ;025884;"O Multi Connect Thunder VII Bluetooth da Mondial é ideal para você que aprecia som de qualidade com potência e muito estilo, suas festas e reuniões com amigos e familiares nunca mais serão as mesmas. Este incrível e sofisticado Multi Connect reproduz MP3 em dispositivos USB/cartão Micro SD, possui conexão bluetooth, entrada auxiliar, entrada para microfone e guitarra, display digital e 80W de potência para você ouvir as suas playlists favoritas . Com alça e para facilitar o transporte e bateria interna recarregável você pode levar o Mult Connect Thunder VII para qual quer lugar e agitar com a galera, viva momentos incríveis a animados com este incrível produto quem também possui flash lights coloridos que pulsam com a música. Mondial, Sua melhor escolha!"
1140;SMARTPHONE BLU STUDIO J1 PRETO               ;025330;" Blu Studio J1 vem com Duas Câmeras, ambas com Flash Led para você tirar fotos dos momentos marcantes da sua vida. Possui sistema de segurança mais reforçado com inicialização verificada, comandos de voz com Sistema inteligente para gerenciamento do consumo da bateria entre outros. Com o Smartphone Blu Studio J1 Dual Sim você tem Acesso a duas linhas telefônicas simultaneamente no mesmo celular sem precisar trocar os chips e aproveitar diferentes planos de chamadas ou pacotes de dados mais convenientes oferecidos pelas operadoras, ou simplesmente para separar ligações de trabalho e pessoais. Além disso você pode acessar suas redes sociais favoritas e com isso ampliar suas redes de relacionamento.', '', '', '"
1166;"TELEVISOR SMART 43"" 43LK5750PSA.BWZ LG       ";025669;"As Lg TVs agora com Inteligência Artificial, a tecnologia de Inteligência Artificial ThinQ AI da LG compreende seus comandos de voz, realizando pesquisas, acessando apps, navegando pela internet, etc, facilitando ainda mais sua experiência, essa função necessita do controle Smart Magic, específico para utilizar a inteligência artificial, vendido separadamente do modelo. Possui HDR Ativo para cenas mais realistas, HDR (High Dynamic Range) é o novo padrão para qualidade de imagem. Ele fornece detalhes mínimos e cores realistas com maior contraste. A LG Smart AI TV suporta vários formatos HDR, incluindo HDR10 Pro e HLG Pro.<br />\\nDynamic Color, que faz com que as cores fiquem mais vivas e nítidas. Fazendo com que as imagens pareçam muito mais naturais. Assista filmes em verdadeira alta definição 1080p com mais nitidez, com imagens mais claras e cheias de detalhes que se perdem em baixas resoluções."
1186;TABLET NB304 M7 3G PLUS QUAD CORE PRETO      ;025933;"O tablet M7 3G Plusda Multilaser é versátil, moderno e perfeito para o seu dia a dia. A tela de 7 polegadas tem o tamanho ideal para deixar sua produtividade mais agradável. O processador Quad Core 1.3GHz auxilia muito na utilização. A capacidade de 16GB memória interna, expansível até 64GB através de cartão micro SD (não incluso) e o sistema operacional Android Oreo (Go Edition) facilita você curtir mais vídeos, fotos, músicas de forma dinâmica e segura."
1220;PEN DRIVE SONY MINI METALICO USM16MX 16GB    ;025975;"Download grátis de software O File Rescue é um é um programa que recupera dados do seu Pen Drive Sony que foram acidentalmente apagados. O software File Rescue  pode ser baixado gratuitamente por proprietários do USM-MX. "
1226;RADIO CJ88 ABRALLK LG                        ;023780;"O novo Mini System LG X Boom CJ88 têm 2250W de potência distribuídos em 3 caixas para um melhor desempenho dos sons graves. Um novo Design do Main Set inspirado nas mesas profissionais de DJ para você transformar sua casa em uma festa. Com o novo Efeito Turbo anime a festa com 3 modos diferentes de efeitos, basta empurrar a alavanca para simular um Avião, um carro de corrida ou uma Moto. Com a nova função DJ Bumerangue você consegue repetir o último trecho da música igual a um DJ profissional, já com as Luzes Multicoloridas transforme sua casa em uma pista de dança. O produto é perfeito para ouvir as músicas do seu Smartphone, pois possui a função Multi Bluetooth, que possibilita parear até 3 dispositivos móveis simultaneamente e o aplicativo LG Music Flow Bluetooth, que permite controlar todas as funções do aparelho em 3 Smartphones ao mesmo tempo, criar seus próprios efeitos com o Gravador de Efeitos que permite gravar efeitos de voz personalizados e enviá-los para os botões do seu Mini System LG, fazer Efeitos DJ via aplicativo e montar um playlist de músicas através da função Multi Playlist.', '', '', '"
1242;SMARTPHONE MOTOROLA MOTO G7 POWER XT1955-1 AZ;025677;" O Moto G7 Power foi desenvolvido para você que não pode parar e precisa ficar conectado o dia inteiro, pois ele vem com uma super bateria de 5000 mAh que te garante até 55horas de carga para executar diversas atividades sem se preocupar em ser interrompido pela falta de energia. Além disso o seu carregador turbo power recarrega a bateria dentro de poucos minutos. Mas além de ter uma bateria excelente e um carregador potente, ele ainda possui outros atributos que te farão se surpreender,  pois ele possui uma incrível tela de 6.2&rdquo;polegadas Full HD+, Um processador octa core de 1.8 Ghz, memória RAM de 3GB e 32GB de memória de armazenamento expansível até 512GB através de cartão micro. Tudo isso para que você possa jogar seus games, Assistir vídeos, séries e fazer qualquer outra atividade favorita com alta performance e autonomia.', '', '', '"
1261;TABLET NB711 MS60 DOURADO/BRANCO MULTILASER  ;025238;"O Multilaser MS60F conta com sensor digital para trazer maior segurança e comodidade na hora de desbloquear o seu aparelho. Além disso, possui um lindo design slim, perfeito para o toque de suas mãos e uma super tela fina IPS HD de 5,5 polegadas. Descubra toda beleza deste tablet, que trará mais dinamismo ao seu dia a dia."
1281;TABLET NB728 MINI MS40G PRETO                ;025366;"Mais leve, rápido e seguro do que nunca, para que você possa curtir ainda mais as suas fotos, vídeos, músicas, redes sociais e tudo mais que for importante para você, seu mundo conectado à mais pura experiência Android alinhado ao design compacto e moderno do MS40G, melhor desempenho: Aplicativos reinventados para fazer o que você gosta de forma mais rápida e prática, seguro: O Google Play Protect é o sistema de segurança sempre ativo, para manter seu dispositivo limpo e seus dados seguros."
1310;TABLET NB296 M7S LITE 8GB PRETO              ;025870;"O Tablet Multilaser tem tela de 7 polegadas, Seu sistema é Quad-Core, no qual vai disponibilizar um bom desempenho do produto em utilização. Memória RAM de 1GB, e para completar o sistema operacional é o Android 8.1, mais rápido e seguro do que nunca, para que você possa curtir mais as suas fotos, vídeos, músicas, redes sociais e tudo mais que você desejar."
